<?xml version="1.0" encoding="ISO-8859-1"?>
<xsd:schema xmlns:xsd="http://www.w3.org/2001/XMLSchema" elementFormDefault="qualified" xmlns:dflt="tablehockey">
	<xsd:import namespace="tablehockey" schemaLocation="tablehockey.xsd" />
	<xsd:element name="dataset">
		<xsd:complexType>
			<xsd:choice minOccurs="0" maxOccurs="unbounded">
				<xsd:element name="final_standing" type="dflt:final_standing__type" />
				<xsd:element name="game" type="dflt:game__type" />
				<xsd:element name="group_participant" type="dflt:group_participant__type" />
				<xsd:element name="groups" type="dflt:groups__type" />
				<xsd:element name="ithf_tournament" type="dflt:ithf_tournament__type" />
				<xsd:element name="matchs" type="dflt:matchs__type" />
				<xsd:element name="participant" type="dflt:participant__type" />
				<xsd:element name="play_off_game" type="dflt:play_off_game__type" />
				<xsd:element name="player" type="dflt:player__type" />
				<xsd:element name="playing_format" type="dflt:playing_format__type" />
				<xsd:element name="rating" type="dflt:rating__type" />
				<xsd:element name="rating_points" type="dflt:rating_points__type" />
				<xsd:element name="stage" type="dflt:stage__type" />
				<xsd:element name="tournament" type="dflt:tournament__type" />
				<xsd:element name="tournament_admin" type="dflt:tournament_admin__type" />
				<xsd:element name="tournament_rating" type="dflt:tournament_rating__type" />
				<xsd:element name="user" type="dflt:user__type" />
				<xsd:any namespace="tablehockey" />
			</xsd:choice>
		</xsd:complexType>
	</xsd:element>
</xsd:schema>
