<?xml version='1.0' encoding='UTF-8'?>
<dataset xmlns:xsi="http://www.w3.org/2001/XMLSchema-instance" xsi:noNamespaceSchemaLocation="../../../dataset.xsd">

    <tournament id="1" name="@any" status="RO" playing_format_id="@null" country="@any" city="@any" address="@any"
        logo="@null" registration_from="@timestamp" tournament_date="@date" registration_to="@timestamp" visible="true" />

    <stage copy_result_stage_id="@null" id="1" name="@any" number_of_hockey="@any" sequence="@any" status="NS"
        tournament_id="1" type="RR" win_points="@any" />

    <groups id="1" name="@any" stage_id="1" />

    <player id="1" city="@any" club="@any" country="@any" date_of_birth="@date" gender="M" name_ascii="@any"
        name="@any" nickname="@any" surname_ascii="@any" surname="@any" verification="@any" world_ranking="@any" />
    <player id="2" city="@any" club="@any" country="@any" date_of_birth="@date" gender="M" name_ascii="@any"
        name="@any" nickname="@any" surname_ascii="@any" surname="@any" verification="@any" world_ranking="@any" />

    <participant id="@any" player_id="1" tournament_id="1" />

    <group_participant id="1" group_id="1" points="2" rank="2" score="2:2" secondary_rank="2" participant_id="1"/>
 
</dataset>
